{
  "receiver_id": null,
  "master_enable": true,
  "activation": {
    "mode": "activate_immediate",
    "requested_time": null
  },
  "transport_params": [{
      "source_ip": "192.168.200.10",
      "destination_ip": "232.105.26.177",
      "source_port": 5000,
      "destination_port": 5000,
      "rtp_enabled": true
    },
    {
      "source_ip": "192.168.210.10",
      "destination_ip": "232.3.28.144",
      "source_port": 5000,
      "destination_port": 5000,
      "rtp_enabled": true
    }
  ]
}
