{
    "receiver_id": "0b174530-e3cf-41e6-bf01-fe55135034f3",
    "master_enable": true,
    "activation": {
        "mode": "activate_scheduled_absolute",
        "requested_time": "1496759200:0"
    },
    "transport_params": [{
        "rtcp_enabled": false,
        "rtcp_source_port": 5010
    },{
        "rtcp_enabled": false,
        "rtcp_source_port": 5010
    }]
}
